{"_type":"https://in-toto.io/Statement/v1","subject":[{"name":"urn:coop:result:0191f8cf-57ef-7c14-a736-9b4b933eb84a","digest":{"sha256":"a83bb659ad0e1210c8945d8dc8fe3daecbc970720dfe4e177e6735fd57efc67d"},"mediaType":"application/vnd.coop.execution-result.v1+json"}],"predicateType":"https://github.com/sambai-dev/coop/blob/main/crates/coop-attestation/FORMAT.md#predicate-v1","predicate":{"schemaVersion":1,"executionId":"0191f8cf-57ef-7c14-a736-9b4b933eb84a","result":{"name":"urn:coop:result:0191f8cf-57ef-7c14-a736-9b4b933eb84a","mediaType":"application/vnd.coop.execution-result.v1+json","sizeBytes":53,"sha256":"a83bb659ad0e1210c8945d8dc8fe3daecbc970720dfe4e177e6735fd57efc67d"},"receipt":{"event_chain":{"complete":true,"events":4,"head":"4b5adf2fe8da9c90f6e0f4fcdf8f6f43f49ffaf2bd84cc84343320fbc3971e7e","version":1},"job_id":"0191f8cf-57ef-7c14-a736-9b4b933eb84a","outcome":"succeeded","receipt_sha256":"700257184d9c8483dd82ebe6e2e0280c90a8d7274ad3aab51c885701f7240345","version":1}}}
